{
  "paper_id": "arxiv_2511_19942",
  "paper_title": "Differential Smoothing Mitigates Sharpening and Improves LLM Reasoning",
  "current_stage": 5,
  "stages_completed": [1, 2, 3, 4],
  "stage_timestamps": { "1": "2026-07-17T00:00:00Z", "2": "2026-07-18T00:00:00Z", "3": "2026-07-18T00:00:00Z", "4": "2026-07-18T00:00:00Z", "5": null, "6": null },
  "stage_confidence": { "1": 0.66, "2": 1.0, "3": 0.6, "4": 0.65, "5": null, "6": null },
  "sir_path": "sir-registry/arxiv_2511_19942/sir.json",
  "repo_path": "paper-repos/arxiv_2511_19942/",
  "artifacts": {
    "sir": "sir-registry/arxiv_2511_19942/sir.json",
    "architecture_plan": "sir-registry/arxiv_2511_19942/architecture_plan.json",
    "repo_initialized": true,
    "notebook_path": null,
    "comparison_report": null
  },
  "confidence_flags": { "training_pipeline": 0.35 },
  "human_review_required": true,
  "human_review_reasons": [
    "training_pipeline confidence (0.35) is below 0.5 — optimizer, learning rate, and training step count are not stated in the paper",
    "This paper's original experiments (1.5B-8B models, full RL fine-tuning) will need to be scoped down for a free-tier Colab GPU reproduction — see implementation_assumptions in sir.json"
  ],
  "loop_count": 0,
  "retry_history": [],
  "created_at": "2026-07-17T00:00:00Z",
  "last_updated": "2026-07-17T00:00:00Z",
  "pipeline_complete": false
}
